{
  "node_id": "secretary.render",
  "version": "1.0.0-rc2",
  "purpose": "Render the validated decision through deterministic templates.",
  "input_contract_ref": "schema:secretary-decision@1",
  "output_contract_ref": "world-v6.secretary-rendered-reply@1",
  "handler_ids": ["secretary.code-renderer"],
  "fallback_handler_ids": ["secretary.code-safe-defer"],
  "parent_id": "secretary.route",
  "child_ids": [],
  "expandable": false,
  "risk_class": "LOW",
  "minimum_vector": {
    "resolutions": {"conversation": "R0", "task": "R0"},
    "granularity": "X1",
    "brain_delegation": "B0",
    "deliberation": "D0",
    "compilation": "C2",
    "authority": "A0",
    "evidence": "E2",
    "model_capability": "M0"
  }
}
