{
  "node_id": "secretary.reason",
  "version": "1.0.0-rc2",
  "purpose": "Produce a bounded structured Secretary proposal from profile-scoped projections.",
  "input_contract_ref": "brain-pack:secretary-001/input@1",
  "output_contract_ref": "schema:secretary-decision@1",
  "handler_ids": ["secretary.manual-brain"],
  "fallback_handler_ids": ["secretary.code-safe-defer"],
  "parent_id": "secretary.route",
  "child_ids": [],
  "expandable": false,
  "risk_class": "MEDIUM",
  "minimum_vector": {
    "resolutions": {"conversation": "R0", "task": "R0"},
    "granularity": "X1",
    "brain_delegation": "B1",
    "deliberation": "D0",
    "compilation": "C1",
    "authority": "A0",
    "evidence": "E1",
    "model_capability": "M1"
  }
}
