{
  "node_id": "secretary.route",
  "version": "1.0.0-rc2",
  "purpose": "Route a Secretary request through the cheapest safe handler and expand only when detail is required.",
  "input_contract_ref": "brain-pack:secretary-001/input@1",
  "output_contract_ref": "schema:secretary-decision@1",
  "handler_ids": ["secretary.code-router"],
  "fallback_handler_ids": ["secretary.manual-brain"],
  "parent_id": null,
  "child_ids": ["secretary.reason", "secretary.render"],
  "expandable": true,
  "risk_class": "LOW",
  "minimum_vector": {
    "resolutions": {"conversation": "R0", "task": "R0"},
    "granularity": "X0",
    "brain_delegation": "B0",
    "deliberation": "D0",
    "compilation": "C2",
    "authority": "A0",
    "evidence": "E2",
    "model_capability": "M0"
  }
}
